<?xml version="1.0" encoding="UTF-8"?>
<properties xmlns="http://java.sun.com/dtd/properties.dtd" xmlns:xsi="http://www.w3.org/2001/XMLSchema-instance"
	xsi:schemaLocation="http://java.sun.com/dtd/properties.dtd properties.xsd ">

	<comment>comment</comment>
	<entry key="sdfasdf">asdfasdfasd</entry>

	<entry key="sdfasdf">asdfasdfasd</entry>
	<entry key="sdfasdf">asdfasdfasd</entry>
	<entry key="sdfasdf">asdfasdfasd</entry>
	<entry key="sdfasdf">asdfasdfasd</entry>
	<entry key="sdfasdf">asdfasdfasd</entry>
	<entry key="sdfasdf">asdfasdfasd</entry>
	<entry key="sdfasdf">asdfasdfasd</entry>
	<entry key="sdfasdf">asdfasdfasd</entry>
	<entry key="sdfasdf">asdfasdfasd</entry>
	<entry key="sdfasdf">asdfasdfasd</entry>
	<entry key="sdfasdf">asdfasdfasd</entry>
	<entry key="sdfasdf">asdfasdfasd</entry>
	<entry key="sdfasdf">asdfasdfasd</entry>
	<entry key="sdfasdf">asdfasdfasd</entry>
	<entry key="sdfasdf">asdfasdfasd</entry>
	<entry key="sdfasdf">asdfasdfasd</entry>
	<entry key="sdfasdf">asdfasdfasd</entry>
	<entry key="sdfasdf">asdfasdfasd</entry>
	<entry key="sdfasdf">asdfasdfasd</entry>
	<entry key="sdfasdf">asdfasdfasd</entry>
	<entry key="sdfasdf">asdfasdfasd</entry>
	<entry key="sdfasdf">asdfasdfasd</entry>
	<entry key="sdfasdf">asdfasdfasd</entry>
	<entry key="sdfasdf">asdfasdfasd</entry>
	<entry key="sdfasdf">asdfasdfasd</entry>
	<entry key="sdfasdf">asdfasdfasd</entry>
	<entry key="sdfasdf">asdfasdfasd</entry>
	<entry key="sdfasdf">asdfasdfasd</entry>
	<entry key="sdfasdf">asdfasdfasd</entry>
	<entry key="sdfasdf">asdfasdfasd</entry>
	<entry key="sdfasdf">asdfasdfasd</entry>
	<entry key="sdfasdf">asdfasdfasd</entry>
	<entry key="sdfasdf">asdfasdfasd</entry>
	<entry key="sdfasdf">asdfasdfasd</entry>
	<entry key="sdfasdf">asdfasdfasd</entry>
	<entry key="sdfasdf">asdfasdfasd</entry>
	<entry key="sdfasdf">asdfasdfasd</entry>
	<entry key="sdfasdf">asdfasdfasd</entry>
	<entry key="sdfasdf">asdfasdfasd</entry>
	<entry key="sdfasdf">asdfasdfasd</entry>
</properties>